{
  "id": "kijo-law-A12_P3",
  "version": "1.0.0",
  "pageTitle": {
    "title": "特定建築設備等の定期検査報告義務",
    "targetSubject": "特定建築設備等の所有者",
    "description": "特定建築設備等の所有者は、定期に建築設備等検査員に検査をさせて、その結果を特定行政庁に報告しなければならない",
    "relatedArticles": ["法::A12:P3"]
  },
  "nodes": [
    {
      "id": "info-001",
      "type": "information",
      "title": "建築設備等",
      "subject": "対象",
      "property": "判定対象となる特定建築設備等",
      "propertyType": "set_definition",
      "description": "昇降機及び特定建築物の昇降機以外の建築設備等"
    },
    {
      "id": "info-002",
      "type": "information",
      "title": "政令設備等",
      "symbol": "T1",
      "subject": "建築設備等",
      "property": "政令で定める特定建築設備等",
      "propertyType": "proposition",
      "description": "安全上、防火上又は衛生上特に重要なものとして政令で定めるもの"
    },
    {
      "id": "info-003",
      "type": "information",
      "title": "指定設備等",
      "symbol": "T2",
      "subject": "建築設備等",
      "property": "特定行政庁が指定する特定建築設備等",
      "propertyType": "proposition",
      "description": "政令設備等以外の特定建築設備等で特定行政庁が指定するもの"
    },
    {
      "id": "info-004",
      "type": "information",
      "title": "国等設備等",
      "symbol": "G",
      "subject": "建築設備等",
      "property": "国等の建築物に設けるもの",
      "propertyType": "proposition",
      "description": "国等の建築物に設ける特定建築設備等"
    },
    {
      "id": "info-005",
      "type": "information",
      "title": "対象設備等",
      "symbol": "T",
      "subject": "建築設備等",
      "property": "報告義務対象設備等",
      "propertyType": "proposition",
      "description": "政令設備等または指定設備等であり、かつ国等設備等でないもの"
    },
    {
      "id": "info-006",
      "type": "information",
      "title": "所有者",
      "symbol": "O",
      "subject": "建築設備等",
      "property": "所有者",
      "propertyType": "set_definition",
      "description": "特定建築設備等の所有者"
    },
    {
      "id": "info-007",
      "type": "information",
      "title": "定期検査",
      "symbol": "I",
      "subject": "所有者",
      "property": "定期検査の実施",
      "propertyType": "proposition",
      "description": "一級建築士、二級建築士又は建築設備等検査員に定期に検査をさせたかどうか"
    },
    {
      "id": "info-008",
      "type": "information",
      "title": "報告",
      "symbol": "R",
      "subject": "所有者",
      "property": "特定行政庁への報告",
      "propertyType": "proposition",
      "description": "検査結果を特定行政庁に報告したかどうか"
    },
    {
      "id": "info-009",
      "type": "information",
      "title": "適合判定",
      "symbol": "J",
      "subject": "所有者",
      "property": "法12条3項への適合",
      "propertyType": "proposition",
      "description": "定期検査報告義務を果たしているか否か"
    },
    {
      "id": "proc-001",
      "type": "process",
      "title": "対象設備等判定",
      "processType": "mechanical",
      "targetSubject": "建築設備等",
      "description": "報告義務の対象となる設備等かを判定",
      "logicExpression": "T = (T1 OR T2) AND (NOT G)"
    },
    {
      "id": "proc-002",
      "type": "process",
      "title": "適合判定",
      "processType": "mechanical",
      "targetSubject": "所有者",
      "description": "報告義務を果たしているかを判定",
      "logicExpression": "J = (NOT T) OR (I AND R)",
      "relatedArticles": ["法::A12:P3"]
    }
  ],
  "edges": [
    { "id": "edge-001", "from": "info-001", "to": "proc-001", "role": "input" },
    { "id": "edge-002", "from": "info-002", "to": "proc-001", "role": "input" },
    { "id": "edge-003", "from": "info-003", "to": "proc-001", "role": "input" },
    { "id": "edge-004", "from": "info-004", "to": "proc-001", "role": "input" },
    { "id": "edge-005", "from": "proc-001", "to": "info-005", "role": "output" },
    { "id": "edge-006", "from": "info-005", "to": "proc-002", "role": "input" },
    { "id": "edge-007", "from": "info-006", "to": "proc-002", "role": "input" },
    { "id": "edge-008", "from": "info-007", "to": "proc-002", "role": "input" },
    { "id": "edge-009", "from": "info-008", "to": "proc-002", "role": "input" },
    { "id": "edge-010", "from": "proc-002", "to": "info-009", "role": "output" }
  ],
  "metadata": {
    "createdAt": "2025-12-10T00:00:00Z",
    "generator": "law-mcp",
    "lawId": "325AC0000000201",
    "lawName": "建築基準法"
  }
}
