{
  "id": "kijo-law-A93_P4",
  "version": "1.0.0",
  "pageTitle": {
    "title": "消防長等への確認申請書受理通知義務",
    "targetSubject": "建築主事等",
    "description": "建築主事等又は指定確認検査機関は、ただし書きの場合に確認申請書を受理したとき等は、遅滞なく消防長等に通知しなければならない",
    "relatedArticles": ["法::A93:P4"]
  },
  "nodes": [
    {
      "id": "info-001",
      "type": "information",
      "title": "建築主事等",
      "subject": "対象",
      "property": "判定対象となる建築主事等",
      "propertyType": "set_definition",
      "description": "建築主事等又は指定確認検査機関"
    },
    {
      "id": "info-002",
      "type": "information",
      "title": "例外該当",
      "symbol": "X",
      "subject": "建築物",
      "property": "第1項ただし書き該当",
      "propertyType": "proposition",
      "description": "第1項ただし書きの場合に該当するか"
    },
    {
      "id": "info-003",
      "type": "information",
      "title": "申請受理",
      "symbol": "R",
      "subject": "建築主事等",
      "property": "確認申請書受理等",
      "propertyType": "proposition",
      "description": "確認申請書を受理又は通知を受けたか"
    },
    {
      "id": "info-004",
      "type": "information",
      "title": "通知実施",
      "symbol": "N",
      "subject": "建築主事等",
      "property": "消防長等への通知",
      "propertyType": "proposition",
      "description": "遅滞なく消防長又は消防署長に通知したか"
    },
    {
      "id": "info-005",
      "type": "information",
      "title": "適合判定",
      "symbol": "J",
      "subject": "建築主事等",
      "property": "法93条4項への適合",
      "propertyType": "proposition",
      "description": "通知義務を遵守しているか否か"
    },
    {
      "id": "proc-001",
      "type": "process",
      "title": "適合判定",
      "processType": "mechanical",
      "targetSubject": "建築主事等",
      "description": "通知義務を遵守しているかを判定",
      "logicExpression": "J = (NOT X) OR (NOT R) OR N",
      "relatedArticles": ["法::A93:P4"]
    }
  ],
  "edges": [
    { "id": "edge-001", "from": "info-001", "to": "proc-001", "role": "input" },
    { "id": "edge-002", "from": "info-002", "to": "proc-001", "role": "input" },
    { "id": "edge-003", "from": "info-003", "to": "proc-001", "role": "input" },
    { "id": "edge-004", "from": "info-004", "to": "proc-001", "role": "input" },
    { "id": "edge-005", "from": "proc-001", "to": "info-005", "role": "output" }
  ],
  "metadata": {
    "createdAt": "2025-12-10T00:00:00Z",
    "generator": "law-mcp",
    "lawId": "325AC0000000201",
    "lawName": "建築基準法"
  }
}
