{
  "id": "kijo-law-A28_P3",
  "version": "1.0.0",
  "pageTitle": {
    "title": "火気使用室の換気設備義務",
    "targetSubject": "建築物",
    "description": "特殊建築物の居室又は火を使用する設備を設けた室には、換気設備を設けなければならない",
    "relatedArticles": ["法::A28:P3"]
  },
  "nodes": [
    {
      "id": "info-001",
      "type": "information",
      "title": "建築物",
      "subject": "対象",
      "property": "判定対象となる建築物",
      "propertyType": "set_definition",
      "description": "建築物"
    },
    {
      "id": "info-002",
      "type": "information",
      "title": "対象室",
      "symbol": "R",
      "subject": "建築物",
      "property": "対象となる室",
      "propertyType": "set_definition",
      "description": "別表第一（い）欄（一）項の特殊建築物の居室又は調理室、浴室等火気使用室"
    },
    {
      "id": "info-003",
      "type": "information",
      "title": "換気設備",
      "symbol": "V",
      "subject": "室",
      "property": "換気設備の設置",
      "propertyType": "proposition",
      "description": "政令で定める技術的基準に従って換気設備を設けているか"
    },
    {
      "id": "info-004",
      "type": "information",
      "title": "例外該当",
      "symbol": "X",
      "subject": "室",
      "property": "政令除外",
      "propertyType": "proposition",
      "description": "政令で定める除外に該当するか"
    },
    {
      "id": "info-005",
      "type": "information",
      "title": "適合判定",
      "symbol": "J",
      "subject": "室",
      "property": "法28条3項への適合",
      "propertyType": "proposition",
      "description": "換気設備義務を遵守しているか否か"
    },
    {
      "id": "proc-001",
      "type": "process",
      "title": "適合判定",
      "processType": "mechanical",
      "targetSubject": "室",
      "description": "換気設備義務を遵守しているかを判定",
      "logicExpression": "J = X OR V",
      "relatedArticles": ["法::A28:P3"]
    }
  ],
  "edges": [
    { "id": "edge-001", "from": "info-001", "to": "proc-001", "role": "input" },
    { "id": "edge-002", "from": "info-002", "to": "proc-001", "role": "input" },
    { "id": "edge-003", "from": "info-003", "to": "proc-001", "role": "input" },
    { "id": "edge-004", "from": "info-004", "to": "proc-001", "role": "input" },
    { "id": "edge-005", "from": "proc-001", "to": "info-005", "role": "output" }
  ],
  "metadata": {
    "createdAt": "2025-12-10T00:00:00Z",
    "generator": "law-mcp",
    "lawId": "325AC0000000201",
    "lawName": "建築基準法"
  }
}
