{
  "id": "kijo-law-A35_P1",
  "version": "1.0.0",
  "pageTitle": {
    "title": "特殊建築物等の避難・消火施設義務",
    "targetSubject": "建築物",
    "description": "特殊建築物、3階建以上、無窓居室を有する建築物、延べ面積1000㎡超の建築物は、避難施設、消火設備等を技術的基準に従って設けなければならない",
    "relatedArticles": ["法::A35"]
  },
  "nodes": [
    {
      "id": "info-001",
      "type": "information",
      "title": "建築物",
      "subject": "対象",
      "property": "判定対象となる建築物",
      "propertyType": "set_definition",
      "description": "建築物"
    },
    {
      "id": "info-002",
      "type": "information",
      "title": "対象建築物",
      "symbol": "T",
      "subject": "建築物",
      "property": "対象建築物か",
      "propertyType": "proposition",
      "description": "特殊建築物、3階建以上、無窓居室有、延べ面積1000㎡超のいずれかに該当"
    },
    {
      "id": "info-003",
      "type": "information",
      "title": "避難施設",
      "symbol": "E",
      "subject": "建築物",
      "property": "避難施設等の設置",
      "propertyType": "proposition",
      "description": "廊下、階段、出入口等の避難施設が技術的基準に適合するか"
    },
    {
      "id": "info-004",
      "type": "information",
      "title": "消火設備",
      "symbol": "F",
      "subject": "建築物",
      "property": "消火設備の設置",
      "propertyType": "proposition",
      "description": "消火栓、スプリンクラー等の消火設備が技術的基準に適合するか"
    },
    {
      "id": "info-005",
      "type": "information",
      "title": "排煙設備等",
      "symbol": "S",
      "subject": "建築物",
      "property": "その他設備の設置",
      "propertyType": "proposition",
      "description": "排煙設備、非常用照明装置、進入口、敷地内通路が技術的基準に適合するか"
    },
    {
      "id": "info-006",
      "type": "information",
      "title": "適合判定",
      "symbol": "J",
      "subject": "建築物",
      "property": "法35条への適合",
      "propertyType": "proposition",
      "description": "避難・消火施設義務を遵守しているか否か"
    },
    {
      "id": "proc-001",
      "type": "process",
      "title": "適合判定",
      "processType": "mechanical",
      "targetSubject": "建築物",
      "description": "避難・消火施設義務を遵守しているかを判定",
      "logicExpression": "J = (NOT T) OR (E AND F AND S)",
      "relatedArticles": ["法::A35"]
    }
  ],
  "edges": [
    { "id": "edge-001", "from": "info-001", "to": "proc-001", "role": "input" },
    { "id": "edge-002", "from": "info-002", "to": "proc-001", "role": "input" },
    { "id": "edge-003", "from": "info-003", "to": "proc-001", "role": "input" },
    { "id": "edge-004", "from": "info-004", "to": "proc-001", "role": "input" },
    { "id": "edge-005", "from": "info-005", "to": "proc-001", "role": "input" },
    { "id": "edge-006", "from": "proc-001", "to": "info-006", "role": "output" }
  ],
  "metadata": {
    "createdAt": "2025-12-10T00:00:00Z",
    "generator": "law-mcp",
    "lawId": "325AC0000000201",
    "lawName": "建築基準法"
  }
}
