{
  "id": "kijo-law-A93_P1",
  "version": "1.0.0",
  "pageTitle": {
    "title": "許可又は確認に関する消防長等の同意義務",
    "targetSubject": "特定行政庁等",
    "description": "特定行政庁、建築主事等又は指定確認検査機関は、許可又は確認をする場合には、消防長等の同意を得なければ確認をすることができない",
    "relatedArticles": ["法::A93:P1"]
  },
  "nodes": [
    {
      "id": "info-001",
      "type": "information",
      "title": "処分権者",
      "subject": "対象",
      "property": "判定対象となる処分権者",
      "propertyType": "set_definition",
      "description": "特定行政庁、建築主事等又は指定確認検査機関"
    },
    {
      "id": "info-002",
      "type": "information",
      "title": "処分種別",
      "symbol": "P",
      "subject": "処分",
      "property": "処分の種類",
      "propertyType": "classification",
      "description": "許可又は確認"
    },
    {
      "id": "info-003",
      "type": "information",
      "title": "例外該当",
      "symbol": "X",
      "subject": "建築物",
      "property": "ただし書き該当",
      "propertyType": "proposition",
      "description": "防火地域及び準防火地域以外の住宅、又は第87条の4準用の確認"
    },
    {
      "id": "info-004",
      "type": "information",
      "title": "同意取得",
      "symbol": "C",
      "subject": "処分権者",
      "property": "消防長等の同意",
      "propertyType": "proposition",
      "description": "消防長又は消防署長の同意を得ているか"
    },
    {
      "id": "info-005",
      "type": "information",
      "title": "適合判定",
      "symbol": "J",
      "subject": "処分権者",
      "property": "法93条1項への適合",
      "propertyType": "proposition",
      "description": "消防同意義務を遵守しているか否か"
    },
    {
      "id": "proc-001",
      "type": "process",
      "title": "適合判定",
      "processType": "mechanical",
      "targetSubject": "処分権者",
      "description": "消防同意義務を遵守しているかを判定",
      "logicExpression": "J = X OR C",
      "relatedArticles": ["法::A93:P1"]
    }
  ],
  "edges": [
    { "id": "edge-001", "from": "info-001", "to": "proc-001", "role": "input" },
    { "id": "edge-002", "from": "info-002", "to": "proc-001", "role": "input" },
    { "id": "edge-003", "from": "info-003", "to": "proc-001", "role": "input" },
    { "id": "edge-004", "from": "info-004", "to": "proc-001", "role": "input" },
    { "id": "edge-005", "from": "proc-001", "to": "info-005", "role": "output" }
  ],
  "metadata": {
    "createdAt": "2025-12-10T00:00:00Z",
    "generator": "law-mcp",
    "lawId": "325AC0000000201",
    "lawName": "建築基準法"
  }
}
