{
  "id": "kijo-law-A51_P1",
  "version": "1.0.0",
  "pageTitle": {
    "title": "卸売市場等の用途に供する特殊建築物の位置",
    "targetSubject": "建築物",
    "description": "都市計画区域内において、卸売市場、火葬場又はと畜場等の処理施設の用途に供する建築物は、都市計画においてその敷地の位置が決定しているものでなければ、新築し、又は増築してはならない",
    "relatedArticles": ["法::A51"]
  },
  "nodes": [
    {
      "id": "info-001",
      "type": "information",
      "title": "建築物",
      "subject": "対象",
      "property": "判定対象となる建築物",
      "propertyType": "set_definition",
      "description": "建築物"
    },
    {
      "id": "info-002",
      "type": "information",
      "title": "都市計画区域内",
      "symbol": "U",
      "subject": "建築物",
      "property": "都市計画区域内か",
      "propertyType": "proposition",
      "description": "都市計画区域内に所在するか"
    },
    {
      "id": "info-003",
      "type": "information",
      "title": "特定用途",
      "symbol": "P",
      "subject": "建築物",
      "property": "特定用途該当",
      "propertyType": "proposition",
      "description": "卸売市場、火葬場、と畜場、汚物処理場、ごみ焼却場等の用途に供するか"
    },
    {
      "id": "info-004",
      "type": "information",
      "title": "敷地位置決定",
      "symbol": "D",
      "subject": "建築物",
      "property": "都市計画による敷地位置決定",
      "propertyType": "proposition",
      "description": "都市計画においてその敷地の位置が決定しているか"
    },
    {
      "id": "info-005",
      "type": "information",
      "title": "許可",
      "symbol": "C",
      "subject": "建築物",
      "property": "特定行政庁の許可",
      "propertyType": "proposition",
      "description": "特定行政庁が都市計画上支障がないと認めて許可したか"
    },
    {
      "id": "info-006",
      "type": "information",
      "title": "政令規模内",
      "symbol": "S",
      "subject": "建築物",
      "property": "政令で定める規模の範囲内",
      "propertyType": "proposition",
      "description": "政令で定める規模の範囲内において新築・増築するか"
    },
    {
      "id": "info-007",
      "type": "information",
      "title": "適合判定",
      "symbol": "J",
      "subject": "建築物",
      "property": "法51条への適合",
      "propertyType": "proposition",
      "description": "卸売市場等の位置規制を遵守しているか否か"
    },
    {
      "id": "proc-001",
      "type": "process",
      "title": "適合判定",
      "processType": "mechanical",
      "targetSubject": "建築物",
      "description": "卸売市場等の位置規制を遵守しているかを判定",
      "logicExpression": "J = (NOT U) OR (NOT P) OR D OR C OR S",
      "relatedArticles": ["法::A51"]
    }
  ],
  "edges": [
    { "id": "edge-001", "from": "info-001", "to": "proc-001", "role": "input" },
    { "id": "edge-002", "from": "info-002", "to": "proc-001", "role": "input" },
    { "id": "edge-003", "from": "info-003", "to": "proc-001", "role": "input" },
    { "id": "edge-004", "from": "info-004", "to": "proc-001", "role": "input" },
    { "id": "edge-005", "from": "info-005", "to": "proc-001", "role": "input" },
    { "id": "edge-006", "from": "info-006", "to": "proc-001", "role": "input" },
    { "id": "edge-007", "from": "proc-001", "to": "info-007", "role": "output" }
  ],
  "metadata": {
    "createdAt": "2025-12-10T00:00:00Z",
    "generator": "law-mcp",
    "lawId": "325AC0000000201",
    "lawName": "建築基準法"
  }
}
