{
  "id": "kijo-law-A86_P6",
  "version": "1.0.0",
  "pageTitle": {
    "title": "一団地認定等の申請における同意取得義務",
    "targetSubject": "申請者",
    "description": "認定又は許可を申請する者は、対象区域内の土地の所有権者等の同意を得なければならない",
    "relatedArticles": ["法::A86:P6"]
  },
  "nodes": [
    {
      "id": "info-001",
      "type": "information",
      "title": "申請者",
      "subject": "対象",
      "property": "判定対象となる申請者",
      "propertyType": "set_definition",
      "description": "第86条第1項から第4項までの認定又は許可を申請する者"
    },
    {
      "id": "info-002",
      "type": "information",
      "title": "他の権利者",
      "symbol": "O",
      "subject": "対象区域",
      "property": "他の権利者の有無",
      "propertyType": "proposition",
      "description": "申請者以外に対象区域内の土地の所有権又は借地権を有する者がいるか"
    },
    {
      "id": "info-003",
      "type": "information",
      "title": "同意取得",
      "symbol": "C",
      "subject": "申請者",
      "property": "同意の取得",
      "propertyType": "proposition",
      "description": "計画について、あらかじめ他の権利者の同意を得ているか"
    },
    {
      "id": "info-004",
      "type": "information",
      "title": "適合判定",
      "symbol": "J",
      "subject": "申請者",
      "property": "法86条6項への適合",
      "propertyType": "proposition",
      "description": "同意取得義務を遵守しているか否か"
    },
    {
      "id": "proc-001",
      "type": "process",
      "title": "適合判定",
      "processType": "mechanical",
      "targetSubject": "申請者",
      "description": "同意取得義務を遵守しているかを判定",
      "logicExpression": "J = (NOT O) OR C",
      "relatedArticles": ["法::A86:P6"]
    }
  ],
  "edges": [
    { "id": "edge-001", "from": "info-001", "to": "proc-001", "role": "input" },
    { "id": "edge-002", "from": "info-002", "to": "proc-001", "role": "input" },
    { "id": "edge-003", "from": "info-003", "to": "proc-001", "role": "input" },
    { "id": "edge-004", "from": "proc-001", "to": "info-004", "role": "output" }
  ],
  "metadata": {
    "createdAt": "2025-12-10T00:00:00Z",
    "generator": "law-mcp",
    "lawId": "325AC0000000201",
    "lawName": "建築基準法"
  }
}
