{
  "id": "kijo-law-A54_P1",
  "version": "1.0.0",
  "pageTitle": {
    "title": "第一種低層住居専用地域等内における外壁の後退距離",
    "targetSubject": "建築物",
    "description": "第一種低層住居専用地域、第二種低層住居専用地域又は田園住居地域内においては、外壁の後退距離は、都市計画で定められた限度以上でなければならない",
    "relatedArticles": ["法::A54:P1"]
  },
  "nodes": [
    {
      "id": "info-001",
      "type": "information",
      "title": "建築物",
      "subject": "対象",
      "property": "判定対象となる建築物",
      "propertyType": "set_definition",
      "description": "建築物"
    },
    {
      "id": "info-002",
      "type": "information",
      "title": "対象地域",
      "symbol": "Z",
      "subject": "建築物",
      "property": "対象地域内か",
      "propertyType": "proposition",
      "description": "第一種低層住居専用地域、第二種低層住居専用地域又は田園住居地域内に所在するか"
    },
    {
      "id": "info-003",
      "type": "information",
      "title": "限度指定",
      "symbol": "M",
      "subject": "地域",
      "property": "外壁の後退距離の限度が定められているか",
      "propertyType": "proposition",
      "description": "都市計画において外壁の後退距離の限度が定められているか"
    },
    {
      "id": "info-004",
      "type": "information",
      "title": "外壁後退距離",
      "symbol": "D",
      "subject": "建築物",
      "property": "外壁の後退距離",
      "propertyType": "numeric",
      "description": "建築物の外壁又はこれに代わる柱の面から敷地境界線までの距離（m）"
    },
    {
      "id": "info-005",
      "type": "information",
      "title": "限度",
      "symbol": "L",
      "subject": "地域",
      "property": "外壁の後退距離の限度",
      "propertyType": "numeric",
      "description": "都市計画で定められた外壁の後退距離の限度（m）"
    },
    {
      "id": "info-006",
      "type": "information",
      "title": "政令除外",
      "symbol": "X",
      "subject": "建築物",
      "property": "政令で定める除外",
      "propertyType": "proposition",
      "description": "政令で定める場合に該当するか"
    },
    {
      "id": "info-007",
      "type": "information",
      "title": "適合判定",
      "symbol": "J",
      "subject": "建築物",
      "property": "法54条1項への適合",
      "propertyType": "proposition",
      "description": "外壁の後退距離規制を遵守しているか否か"
    },
    {
      "id": "proc-001",
      "type": "process",
      "title": "適合判定",
      "processType": "mechanical",
      "targetSubject": "建築物",
      "description": "外壁の後退距離規制を遵守しているかを判定",
      "logicExpression": "J = (NOT Z) OR (NOT M) OR X OR (D >= L)",
      "relatedArticles": ["法::A54:P1"]
    }
  ],
  "edges": [
    { "id": "edge-001", "from": "info-001", "to": "proc-001", "role": "input" },
    { "id": "edge-002", "from": "info-002", "to": "proc-001", "role": "input" },
    { "id": "edge-003", "from": "info-003", "to": "proc-001", "role": "input" },
    { "id": "edge-004", "from": "info-004", "to": "proc-001", "role": "input" },
    { "id": "edge-005", "from": "info-005", "to": "proc-001", "role": "input" },
    { "id": "edge-006", "from": "info-006", "to": "proc-001", "role": "input" },
    { "id": "edge-007", "from": "proc-001", "to": "info-007", "role": "output" }
  ],
  "metadata": {
    "createdAt": "2025-12-10T00:00:00Z",
    "generator": "law-mcp",
    "lawId": "325AC0000000201",
    "lawName": "建築基準法"
  }
}
