{
  "id": "kijo-law-A59_P1",
  "version": "1.0.0",
  "pageTitle": {
    "title": "高度利用地区における容積率等の制限",
    "targetSubject": "建築物",
    "description": "高度利用地区内においては、建築物の容積率及び建蔽率並びに建築物の建築面積は、都市計画において定められた内容に適合するものでなければならない",
    "relatedArticles": ["法::A59:P1"]
  },
  "nodes": [
    {
      "id": "info-001",
      "type": "information",
      "title": "建築物",
      "subject": "対象",
      "property": "判定対象となる建築物",
      "propertyType": "set_definition",
      "description": "建築物"
    },
    {
      "id": "info-002",
      "type": "information",
      "title": "高度利用地区",
      "symbol": "Z",
      "subject": "建築物",
      "property": "高度利用地区内か",
      "propertyType": "proposition",
      "description": "高度利用地区内に所在するか"
    },
    {
      "id": "info-003",
      "type": "information",
      "title": "都市計画適合",
      "symbol": "C",
      "subject": "建築物",
      "property": "都市計画の内容への適合",
      "propertyType": "proposition",
      "description": "容積率、建蔽率、建築面積が都市計画において定められた内容に適合するか"
    },
    {
      "id": "info-004",
      "type": "information",
      "title": "ただし書該当",
      "symbol": "X",
      "subject": "建築物",
      "property": "ただし書該当",
      "propertyType": "proposition",
      "description": "移転・除却が容易な建築物、公益上必要な建築物、又は許可を受けたもの"
    },
    {
      "id": "info-005",
      "type": "information",
      "title": "適合判定",
      "symbol": "J",
      "subject": "建築物",
      "property": "法59条1項への適合",
      "propertyType": "proposition",
      "description": "高度利用地区の容積率等規制を遵守しているか否か"
    },
    {
      "id": "proc-001",
      "type": "process",
      "title": "適合判定",
      "processType": "mechanical",
      "targetSubject": "建築物",
      "description": "高度利用地区の容積率等規制を遵守しているかを判定",
      "logicExpression": "J = (NOT Z) OR X OR C",
      "relatedArticles": ["法::A59:P1"]
    }
  ],
  "edges": [
    { "id": "edge-001", "from": "info-001", "to": "proc-001", "role": "input" },
    { "id": "edge-002", "from": "info-002", "to": "proc-001", "role": "input" },
    { "id": "edge-003", "from": "info-003", "to": "proc-001", "role": "input" },
    { "id": "edge-004", "from": "info-004", "to": "proc-001", "role": "input" },
    { "id": "edge-005", "from": "proc-001", "to": "info-005", "role": "output" }
  ],
  "metadata": {
    "createdAt": "2025-12-10T00:00:00Z",
    "generator": "law-mcp",
    "lawId": "325AC0000000201",
    "lawName": "建築基準法"
  }
}
