{
  "id": "kijo-law-A7_P2",
  "version": "1.0.0",
  "pageTitle": {
    "title": "完了検査申請の期限義務",
    "targetSubject": "建築主",
    "description": "完了検査の申請は、工事完了日から4日以内に建築主事等に到達するようにしなければならない",
    "relatedArticles": ["法::A7:P2"]
  },
  "nodes": [
    {
      "id": "info-001",
      "type": "information",
      "title": "工事完了日",
      "symbol": "D",
      "subject": "建築物",
      "property": "工事完了日",
      "propertyType": "numeric",
      "description": "第6条第1項の規定による工事が完了した日"
    },
    {
      "id": "info-002",
      "type": "information",
      "title": "申請到達日",
      "symbol": "A",
      "subject": "建築主",
      "property": "申請が建築主事等に到達した日",
      "propertyType": "numeric",
      "description": "完了検査申請が建築主事等に到達した日"
    },
    {
      "id": "info-003",
      "type": "information",
      "title": "やむを得ない理由",
      "symbol": "R",
      "subject": "建築主",
      "property": "申請遅延のやむを得ない理由",
      "propertyType": "proposition",
      "description": "国土交通省令で定めるやむを得ない理由があるかどうか（ただし書き）"
    },
    {
      "id": "info-004",
      "type": "information",
      "title": "期限内到達",
      "symbol": "T",
      "subject": "建築主",
      "property": "4日以内の到達",
      "propertyType": "proposition",
      "description": "工事完了日から4日以内に申請が到達したかどうか"
    },
    {
      "id": "info-005",
      "type": "information",
      "title": "適合判定",
      "symbol": "J",
      "subject": "建築主",
      "property": "法7条2項への適合",
      "propertyType": "proposition",
      "description": "期限内到達義務を果たしているか否か"
    },
    {
      "id": "proc-001",
      "type": "process",
      "title": "期限計算",
      "processType": "mechanical",
      "targetSubject": "建築主",
      "description": "工事完了日から申請到達日までの日数を計算",
      "logicExpression": "T = (A - D) <= 4"
    },
    {
      "id": "proc-002",
      "type": "process",
      "title": "適合判定",
      "processType": "mechanical",
      "targetSubject": "建築主",
      "description": "期限内到達またはやむを得ない理由があるかを判定",
      "logicExpression": "J = T OR R",
      "relatedArticles": ["法::A7:P2"]
    }
  ],
  "edges": [
    { "id": "edge-001", "from": "info-001", "to": "proc-001", "role": "input" },
    { "id": "edge-002", "from": "info-002", "to": "proc-001", "role": "input" },
    { "id": "edge-003", "from": "proc-001", "to": "info-004", "role": "output" },
    { "id": "edge-004", "from": "info-004", "to": "proc-002", "role": "input" },
    { "id": "edge-005", "from": "info-003", "to": "proc-002", "role": "input" },
    { "id": "edge-006", "from": "proc-002", "to": "info-005", "role": "output" }
  ],
  "metadata": {
    "createdAt": "2025-12-10T00:00:00Z",
    "generator": "law-mcp",
    "lawId": "325AC0000000201",
    "lawName": "建築基準法"
  }
}
